{
    "$schema": "http://json-schema.org/draft-07/schema#",
    "$id": "https://pegues.io/schemas/resume/v3.1.3",
    "title": "ParsedResume Schema",
    "description": "Schema for validating parsed resume data structure",
    "version": "3.1.3",
    "date": "2025-02-17",
    "author": "Jeremiah Pegues <jeremiah@pegues.io>",
    "license": "MIT",
    "type": "object",
    "properties": {
        "$schema": {
            "type": "string",
            "description": "Schema identifier for validation"
        },
        "parsedResumeId": { 
            "type": "string",
            "description": "Unique identifier for the resume instance"
        },
        "source": {
            "type": "object",
            "properties": {
                "type": { "type": "string" },
                "rawResumeId": { "type": "string" }
            },
            "required": ["type", "rawResumeId"]
        },
        "dateParsed": { "type": "string", "format": "date-time" },
        "parseTime": { "type": "string" },
        "data": {
            "type": "object",
            "properties": {
                "personalInfo": {
                    "type": "object",
                    "properties": {
                        "id": { "type": "string" },
                        "name": { "type": "string" },
                        "contactDetails": {
                            "type": "object",
                            "properties": {
                                "id": { "type": "string" },
                                "email": { "type": "string", "format": "email" },
                                "phoneNumber": { "type": "string" },
                                "address": { "type": "string" }
                            },
                            "required": ["id", "email", "phoneNumber", "address"]
                        }
                    },
                    "required": ["id", "name", "contactDetails"]
                },
                "summary": {
                    "type": "object",
                    "properties": {
                        "id": { "type": "string" },
                        "content": { "type": "string" }
                    },
                    "required": ["id", "content"]
                },
                "workExperience": {
                    "type": "object",
                    "properties": {
                        "id": { "type": "string" },
                        "display": { 
                            "type": "string",
                            "enum": ["traditional", "operations-achievements"],
                            "description": "Determines whether experience is displayed in traditional format or grouped by operations and achievements."
                        },
                        "items": {
                            "type": "array",
                            "items": {
                                "type": "object",
                                "properties": {
                                    "id": { "type": "string" },
                                    "position": { "type": "string" },
                                    "company": { "type": "string" },
                                    "start_date": { "type": "string", "format": "date" },
                                    "end_date": { "type": "string", "format": "date" },
                                    "currentRole": { "type": "boolean" },
                                    "operations": {
                                        "type": "array",
                                        "items": { "type": "string" },
                                        "description": "Tasks and responsibilities performed in the role."
                                    },
                                    "achievements": {
                                        "type": "array",
                                        "items": { "type": "string" },
                                        "description": "Key accomplishments and successes in the role."
                                    }
                                },
                                "required": ["id", "position", "company", "start_date", "end_date"]
                            }
                        }
                    },
                    "required": ["id", "display", "items"]
                },
                "skills": {
                    "type": "object",
                    "properties": {
                        "id": { "type": "string" },
                        "items": {
                            "type": "array",
                            "items": {
                                "type": "object",
                                "properties": {
                                    "id": { "type": "string" },
                                    "skill": { "type": "string" }
                                },
                                "required": ["id", "skill"]
                            }
                        }
                    },
                    "required": ["id", "items"]
                },
                "education": {
                    "type": "object",
                    "properties": {
                        "id": { "type": "string" },
                        "items": {
                            "type": "array",
                            "items": {
                                "type": "object",
                                "properties": {
                                    "id": { "type": "string" },
                                    "degree": { "type": "string" },
                                    "institution": { "type": "string" },
                                    "start_date": { "type": "string", "format": "date" },
                                    "end_date": { "type": "string", "format": "date" },
                                    "description": { "type": "string" }
                                },
                                "required": ["id", "degree", "institution", "start_date", "end_date"]
                            }
                        }
                    },
                    "required": ["id", "items"]
                },
                "certifications": {
                    "type": "object",
                    "properties": {
                        "id": { "type": "string" },
                        "items": {
                            "type": "array",
                            "items": {
                                "type": "object",
                                "properties": {
                                    "id": { "type": "string" },
                                    "name": { "type": "string" },
                                    "institution": { "type": "string" },
                                    "date": { "type": "string", "format": "date" }
                                },
                                "required": ["id", "name", "institution", "date"]
                            }
                        }
                    },
                    "required": ["id", "items"]
                }
            }
        }
    },
    "required": ["parsedResumeId", "source", "dateParsed", "parseTime", "data"]
}